{
  "schema_version": "1.0",
  "source_path": "/mnt/d/hustagent/work/wsl_simple_loop_normalized.py",
  "workload_name": "work",
  "functions": [
    "_load_original",
    "combine",
    "equivalent",
    "make_input",
    "unit"
  ],
  "loops": 0,
  "hazards": [],
  "contract_functions": [
    "combine",
    "equivalent",
    "make_input",
    "unit"
  ],
  "contract_complete": true,
  "parallelizable": false,
  "rationale": [
    "Unit function delegates to an external module with unknown side effects; cannot guarantee independence of item computations."
  ]
}