{
  "schema_version": "1.0",
  "source_path": "/mnt/d/hustagent/work/wsl_simple_loop_normalized_v2.py",
  "workload_name": "simple_serial_loop",
  "functions": [
    "_load_original",
    "combine",
    "equivalent",
    "make_input",
    "unit"
  ],
  "loops": 1,
  "hazards": [
    "shared_mutation:append"
  ],
  "contract_functions": [
    "combine",
    "equivalent",
    "make_input",
    "unit"
  ],
  "contract_complete": true,
  "parallelizable": true,
  "rationale": [
    "The loop iterates directly over the entry input.",
    "Each iteration calls one per-item function and only appends its result.",
    "A separate combine function consumes the collected outputs.",
    "The per-item function contains no explicit global/nonlocal declaration.",
    "The loop iterates directly over the entry input.",
    "Each iteration calls one per-item function and only appends its result.",
    "A separate combine function consumes the collected outputs.",
    "The per-item function contains no explicit global/nonlocal declaration.",
    "Verified normalization binds the ordinary serial loop to the explicit workload contract."
  ]
}